Behavioral,Observer,"Suppose that you are working for a company that manufactures smoke detectors, motion sensors, and other security devices. To take advantage of new market opportunities, your company plans to introduce a new line of devices. These devices will be able to send a signal to a security card that can be installed in most computers. The hope is that companies that make security-monitoring systems will integrate these devices and cards with their systems. To make it easy to integrate the cards with monitoring systems, you have been given the task of creating an easy-to-use API. The API must allow your future customers to easily integrate their programs with it so their programs will receive notifications from the security card. It must work without forcing the customers to alter the architecture of their existing software. All that the API may assume about the customer's software is that at least one, and possibly more than one, object will have a method that should be called when a notification is received from a security device.",Patterns Of Java,GOF
Behavioral,State,Suppose that you are writing a dialog for editing parameters of a program. The dialog will have buttons for specifying the disposition of changes you have made. The dialog will have an OK button that saves the parameter values in the dialog to both a file and the program's working values. The dialog will have a Save button that saves the parametervalues only to a file. The dialog will have an Apply button that saves the parameter values only to the program's working values. The dialog will have a Revert button that restores the dialog values from the file.,Patterns Of Java,GOF
Behavioral,Null Object,"You have been given the task of writing classes to encapsulate an enterprise's business rules. Because these classes will be used in a variety of environments, there is a requirement that these objects be able to route warning messages to a dialog box, a log file, other destinations, or nowhere at all.",Patterns Of Java,GOF
Behavioral,Strategy,Suppose you have to write a program that displays calendars. One of the requirements for the program is that it be able to display sets of holidays celebrated by different nations and different religious groups. The user must be able to specify which sets of holidays to display. You would like to satisfy the requirement by putting the logic for each set of holidays in a separate class. This will give you a set of small classes to which you could easily add more classes. You want classes that use these holiday classes to be unaware of any specific set of holidays.,Patterns Of Java,GOF
Behavioral,Template Method,"Suppose that you have the task of writing a reusable class for logging users into an application or applet. In addition to being reusable and easy to use, the tasks of the class will be to: Prompt the user for a user ID and password. Authenticate the user ID and password. The result of the authentication operation should be an object. If the authentication operation produces some information needed later as proof of authentication, then the object produced by the authentication operation should encapsulate the information. While the authentication operation is in progress, the user should see a changing and possibly animated display that tells the user that authentication is in progress and all is well. Notify the rest of the application or applet that login is complete and make the object produced by the authentication operation available to the rest of the application. Every application or applet will have to provide its own logic for these tasks.",Patterns Of Java,GOF
Behavioral,Visitor,"Suppose you have the assignment of adding new features to a word processor related to its ability to produce a table of contents. From the viewpoint of a user, there will be a dialog that allows the user to specify information that guides the building of a table of contents. The word processor allows a style name to be associated with each paragraph. The dialog will allow the user to specify which paragraph styles correspond to headings that should appear in the table of contents. The word processor uses information specified in the dialog to build an internal table that contains all the information it needs to build a multilevel table of contents. In the rest of this description, the table is referred to as the internal ToC table. The information in each row of the table will include a level number that can correspond to chapter, section, and subsection or any other hierarchical organization the user wants to represent. The rows of the table will also include a paragraph style and other information for formatting the table of contents. If a paragraph style appears in the table, it means paragraphs with that style are headings whose first line will appear in that level of a table of contents. In addition to adding the dialog and internal ToC table to the word processor, you will have to add these table-of-contents-related features: Generate and insert a table of contents for a single file document into that document. Reorganize a single file document into a multifile document, based on a heading level in the internal ToC table.",Patterns Of Java,GOF
