Behavioral,Chain of Responsibility,"The chain of responsibility pattern is used to process varied requests, each of which may be dealt with by a different handler. The chain of responsibility pattern is a design pattern that defines a linked list of handlers, each of which is able to process requests. When a request is submitted to the chain, it is passed to the first handler in the list that is able to process it. The chain of responsibility pattern is a Gang of Four design pattern. This is a behavioural pattern as it defines a manner for controlling communication between classes or entities. The chain of responsibility pattern is used to process varied requests, each of which may be dealt with by a different handler. The design pattern promotes loose coupling by allowing a series of handlers to be created in a linked list or chain. The request is passed to the first handler in the chain, which will either process it or pass it on to its successor. This continues until the request is processed or the end of the chain is reached. The handler responsible for the final processing of the request need not be known beforehand. This style of processing is used by the exception handling system in C#. When an exception is thrown, the method that caused the exception is given the chance to process it, via a try-catch block. If no suitable catch is available, the exception moves up to the calling method, which may include a try-catch. This continues until the exception is handled or until there are no more possible handlers. The try-catch block itself can be thought of as using the chain of responsibility when multiple catches, each for a different type of exception, are given the option to handle an exception.",Patterns Of Java,GOF
Behavioral,Command,"The command pattern is used to express a request, including the call to be made and all of its required parameters, in a command object. The command may then be executed immediately or held for later use. The command pattern is a design pattern that enables all of the information for a request to be contained within a single object. The command can then be invoked as required, often as part of a batch of queued commands with rollback capabilities. The command pattern is a Gang of Four design pattern. This is a behavioural pattern as it defines a manner for controlling communication between classes or entities. The command pattern is used to express a request, including the call to be made and all of its required parameters, in a command object. The command may then be executed immediately or held for later use. Often a queue of commands will be created that can be executed in a batch. The command object does not contain the functionality that is to be executed, only the information required to perform an action. The functionality is contained within receiver objects. This removes the direct link between the command definitions and the functionality, promoting loose coupling. Neither of these object types is responsible for determining the time of execution of the command. This is controlled using an invoker. The command pattern is useful when supporting activities that require the execution of a series of commands. The command objects can be held in a queue and processed sequentially. If each command is stored on a stack after it is executed, and if the commands are reversible, this allows the implementation of a rollback or multi-level undo facility.",Patterns Of Java,GOF
Behavioral,Interpreter,"The interpreter pattern is used to define the grammar for instructions that form part of a language or notation, whilst allowing the grammar to be easily extended. The interpreter pattern is a design pattern that is useful when developing domain-specific languages or notations. The pattern allows the grammar for such a notation to be represented in an object-oriented fashion that can easily be extended. The interpreter pattern is a Gang of Four design pattern. This is a behavioural pattern as it defines a manner for controlling communication between classes or entities. The interpreter pattern is used to define the grammar for instructions that form part of a language or notation, whilst allowing the grammar to be easily extended. The interpreter pattern performs activities base upon a hierarchy of expressions. Each expression is terminal, meaning that it is a standalone structure that can be immediately evaluated, or non-terminal, meaning that it is composed of one or more expressions. The tree structure is similar to that defined by the composite design pattern, with terminal expressions being leaf objects and non-terminal expressions being composites. The tree contains the expressions to be evaluated and is usually generated by a parser. The parser itself is not a part of the interpreter pattern. The interpreter design pattern is useful for simple languages where performance is not critical. As the grammar becomes more complex, the number of different expression types, each represented by its own class, can become unwieldy and lead to unmanageable class hierarchies. This can also slow the processing of the expressions. For these reasons, the pattern is considered to be inefficient and is rarely used. However, it should not be discounted for some situations.",Patterns Of Java,GOF
Behavioral,Iterator,"The iterator pattern is used to provide a standard interface for traversing a collection of items in an aggregate object without the need to understand its underlying structure. The iterator pattern is a design pattern that provides a means for the elements of an aggregate object to be accessed sequentially without knowledge of its structure. This allows traversing of lists, trees and other structures in a standard manner. The iterator pattern is a Gang of Four design pattern. This is a behavioural pattern as it defines a manner for controlling communication between classes or entities. The iterator pattern is used to provide a standard interface for traversing a collection of items in an aggregate object without the need to understand the underlying structure of that object. The interface provided is generally simplistic, providing methods to move to the next item, return to the beginning of the list, retrieve the current item and determine if the end of the list has been reached. A variation upon the iterator design pattern is used extensively within C# and the .NET framework. Iterators are included in the standard array and collection classes and can easily be added to your own classes by implementing the IEnumerable and IEnumerator interfaces. C# version 2.0 also includes the yield keyword to simplify the process of creating iterators.",Patterns Of Java,GOF
Behavioral,Mediator,"The mediator pattern is used to reduce coupling between classes that communicate with each other. Instead of classes communicating directly, and thus requiring knowledge of their implementation, the classes send messages via a mediator object. The mediator pattern is a design pattern that promotes loose coupling of objects by removing the need for classes to communicate with each other directly. Instead, mediator objects are used to encapsulate and centralise the interactions between classes. The mediator pattern is a Gang of Four design pattern. This is a behavioural pattern as it defines a manner for controlling communication between classes or entities. The mediator pattern is used to reduce coupling between classes that communicate with each other. Instead of classes communicating directly, and thus requiring knowledge of their implementation, the classes send messages to a mediator object. The mediator object then transmits the messages to the other classes in a manner that they can interpret. The object initiating a message therefore requires no knowledge of the objects that will receive it. The mediator pattern promotes loose coupling of classes by removing the direct dependencies. It can also simplify communication in general when a program contains a large number of classes that interact. Each class need only know how to pass messages to its mediator, rather than to numerous colleagues. This simplified communication can improve the readability of the code. It can also increase the maintainability, as a class and its mediator may be changed without requiring modifications to other types.",Patterns Of Java,GOF
Behavioral,Memento,"The memento pattern is used to capture the current state of an object and store it in such a manner that it can be restored at a later time without breaking the rules of encapsulation. The memento pattern is a design pattern that permits the current state of an object to be stored without breaking the rules of encapsulation. The originating object can be modified as required but can be restored to the saved state at any time. The memento pattern is a Gang of Four design pattern. This is a behavioural pattern as it defines a manner for controlling communication between classes or entities. The memento pattern is used to capture the current state of an object and store it in such a manner that it can be restored at a later time. Importantly, the pattern allows for the internal state of an object to be saved without breaking the rules of encapsulation. This design pattern is commonly used to provide an application with Undo functionality.",Patterns Of Java,GOF
Behavioral,Observer,"The observer pattern is used to allow an object to publish changes to its state. Other objects subscribe to be immediately notified of any changes. The observer pattern is a design pattern that defines a link between objects so that when one object's state changes, all dependent objects are updated automatically. This pattern allows communication between objects in a loosely coupled manner. The observer pattern is a Gang of Four design pattern. This is a behavioural pattern as it defines a manner for controlling communication between classes or entities. The observer pattern is used to allow a single object, known as the subject, to publish changes to its state. Many other observer objects that depend upon the subject can subscribe to it so that they are immediately and automatically notified of any changes to the subject's state. The pattern gives loose coupling between the subject and its observers. The subject holds a collection of observers that are set only at run-time. Each observer may be of any class that inherits from a known base class or implements a common interface. The actual functionality of the observers and their use of the state data need not be known by the subject. A variation upon the observer pattern is seen in the .NET framework's event model. In this model, many objects may subscribe to an event and automatically be notified when the event is triggered. The observer pattern is also used widely in user interface development, particularly with data binding functionality.",Patterns Of Java,GOF
Behavioral,State,"The state pattern is used to alter the behaviour of an object as its internal state changes. The pattern allows the class for an object to apparently change at run-time. The state pattern is a design pattern that allows an object to completely change its behaviour depending upon its current internal state. By substituting classes within a defined context, the state object appears to change its type at run-time. The state pattern is a Gang of Four design pattern. This is a behavioural pattern as it defines a manner for controlling communication between classes or entities. The state pattern is used to alter the behaviour of an object as its internal state changes. The pattern allows the class for an object to change at run-time without changing the interface used to access the object or losing the current state. The class change is hidden to the outside world with the use of a wrapper object, or context. The state pattern is useful when creating object-oriented state machines, where the functionality of an object changes fundamentally according to its state. By using multiple concrete classes, each inheriting from the same base class, large differences in functionality are possible without resorting to numerous ""if"" or ""switch"" statements.",Patterns Of Java,GOF
Behavioral,Strategy,The strategy pattern is used to create an interchangeable family of algorithms from which the required process is chosen at run-time. The strategy pattern is a design pattern that allows a set of similar algorithms to be defined and encapsulated in their own classes. The algorithm to be used for a particular purpose may then be selected at run-time according to your requirements. The strategy pattern is a Gang of Four design pattern. This is a behavioural pattern as it defines a manner for controlling communication between classes or entities. The strategy pattern is used to create an interchangeable family of algorithms from which the required process is chosen at run-time. This allows the behaviour of a program to change dynamically according to configuration details or user preferences. It also increases flexibility by allowing new algorithms to be easily incorporated in the future.,Patterns Of Java,GOF
Behavioral,Template Method,"The template method pattern is used to define the basic steps of an algorithm and allow the implementation of the individual steps to be changed. The template method pattern is a design pattern that allows a group of interchangeable, similarly structured, multi-step algorithms to be defined. Each algorithm follows the same series of actions but provides a different implementation of the steps. The template method pattern is a Gang of Four design pattern. This is a behavioural pattern as it defines a manner for controlling communication between classes or entities. The template method pattern is used to define the basic steps of an algorithm and allow the implementation of the individual steps to be changed. This is similar to the strategy design pattern. The key difference is the ability to vary parts of the algorithm rather than replacing the algorithm in its entirety. The overall structure of the basic algorithm is defined in an abstract base class. This class may include some real functionality but often just defines the order in which the overridable steps will be executed. The implementations for the steps are defined in subclasses. This use of inheritance promotes loose coupling, as the calling function need not know which algorithm is to be executed. Correct use of the pattern also reduces duplication of code.",Patterns Of Java,GOF
Behavioral,Visitor,"The visitor pattern is used to separate a relatively complex set of structured data classes from the functionality that may be performed upon the data that they hold. The visitor pattern is a design pattern that separates a set of structured data from the functionality that may be performed upon it. This promotes loose coupling and enables additional operations to be added without modifying the data classes. The visitor pattern is a Gang of Four design pattern. This is a behavioural pattern as it defines a manner for controlling communication between classes or entities. The visitor pattern is used to separate a relatively complex set of structured data classes from the functionality that may be performed upon the data that they hold. This allows the creation of a data model with limited internal functionality and a set of visitors that perform operations upon the data. The pattern specifically allows each of the elements of a data structure to be visited in turn without knowing the details of the structure beforehand. The key benefit of separating the data model from the algorithms that may be applied to it is the ability to add new operations easily. The classes of the data structure are initially created with the inclusion of a method that may be called by a visitor object. This method performs a callback to the visitor, passing itself to the visitor's method as a parameter. The visitor can then perform operations upon the data object. To add a new operation, a new visitor class is created with the appropriate callback method. The data classes need no further modification. A second benefit of the design pattern is that a single visitor object is used to visit all elements of the data structure. The visitor object can maintain state between calls to individual data objects.",Patterns Of Java,GOF
Creational,Factory Method,"Consider the problem of writing a framework for desktop applications. Such applications are typically organized around documents or files. Their operation usually begins with a command to create or edit a word processing document, spreadsheet, time line, or other type of document the application is intended to work with. A framework to support this type of application will include high-level support for common operations such as creating, opening, or saving documents.",Patterns Of Java,GOF
Creational,Abstract Factory,"Suppose you have the task of building a user-interface framework that works on top of multiple windowing systems, such as Windows, Motif, or MacOS. It must work on each platform with the platform's native look and feel. You organize it by creating an abstract class for each type of widget (text field, pushbutton, list box, etc.) and then writing a concrete subclass of each of those classes for each supported platform. To make this robust, you need to ensure that all the widget objects created are for the desired platform.",Patterns Of Java,GOF
Creational,Builder,Consider the problem of writing an email gateway program. The program receives e-mail messages that are in MIME format. It forwards them in a different format for different kinds of e-mail systems.,Patterns Of Java,GOF
Creational,Prototype,"Suppose that you are writing a Computer-Assisted Design (CAD) program that allows its users to draw diagrams from a palette of symbols. The program will have a core set of built-in symbols. However, people with different and specialized interests will use the program. The core set of symbols will not be adequate for people with a specialized interest. These people will want additional symbols that are specific to their interests. Most users of this program will have a specialized interest. It must be possible to provide additional sets of symbols that users can add to the program to suit their needs.",Patterns Of Java,GOF
Creational,Singleton,"Suppose you need to write a class that an applet can use to ensure that no more than one audio clip is played at a time. If an applet contains two pieces of code that independently play audio clips, then it is possible for both to be playing at the same time. When two audio clips play at the same time, the results depend on the platform. The results may range from confusing, with users hearing both audio clips together, to terrible, with the platform's sound-producing mechanism unable to cope with playing two different audio clips at once.",Patterns Of Java,GOF
Creational,Object Pool,"Suppose you have been given the assignment of writing a class library to provide access to a proprietary database. Clients will send queries to the database through a network connection. The database server will receive queries through the network connection and return the results through the same connection. For a program to query the database, it must have a connection to the database. A convenient way for programmers who will use the library to manage connections is for each part of a program that needs a connection to create its own connection.",Patterns Of Java,GOF
Structural,Adapter,"Suppose that you are writing a method that copies an array of objects. The method is supposed to filter out objects that do not meet certain criteria, so that the copied array may not contain all of the elements in the original array. To promote reuse, you want the method to be independent of the filtering criteria being used.",Patterns Of Java,GOF
Behavioral,Iterator,"Suppose you are writing classes to browse inventory in a warehouse. There will be a user interface that allows a user to see the description, quantity on hand, location, and other information about each inventory item. The inventory browsing classes will be part of a customizable application. For this reason, they must be independent of the actual class that provides collections of inventory items.",Patterns Of Java,GOF
Structural,Bridge,"Suppose you need to provide Java classes that access physical sensors for control applications. These are devices such as scales, speed-measuring devices, and location-sensing devices. What these devices have in common is that they perform a physical measurement and produce a number. One way that these devices differ is in the type of measurement that they produce. The scale produces a single number based on a measurement at a single point in time. The speed-measuring device produces a single measurement that is an average over a period of time. The location-sensing device produces a stream of measurements. The software that you are writing will need to work with sensors from multiple manufacturers called Eagle and Hawk.",Patterns Of Java,GOF
Structural,Facade,"Consider the organization of classes to support the creation and sending of email messages. To use these classes, a client must know of at least these six of them, the relationships between them, and the order in which it must create instances of the classes. If every client of these classes must take on this additional complexity, it makes the email classes more difficult to reuse.",Patterns Of Java,GOF
Structural,Flyweight,"Suppose that you are writing a word processor. The word processor is structured around classes such as DocumentElement, DocChar, DocumentContainer, and CharacterContext. Each DocChar object represents an individual character within a document. However, the current design allocates a separate DocChar object for each character, potentially leading to excessive memory usage, especially for larger documents. To address this issue, there's a proposal to optimize memory usage by introducing shared DocChar objects for characters that occur multiple times within the document. This revised design involves reorganizing the classes and moving extrinsic attributes like font information outside the DocChar class into a CharacterContext class.",Patterns Of Java,GOF
Structural,Dynamic Linkage,"Suppose you are writing software for a new kind of smart food processor that can be fed raw ingredients and by slicing, dicing, mixing, boiling, baking, frying, and stirring is able to produce cooked, ready-to-eat food. On a mechanical level, the new food processor is a very sophisticated piece of equipment. However, a crucial part of the food processor is a selection of programs to prepare different kinds of foods. A program that can turn flour, water, yeast, and other ingredients into different kinds of bread is very different from a program that can stir-fry shrimp to exactly the right texture. The food processor will be required to run a great variety of programs that allow it to produce a great variety of foods. Because of the large variety of programs that will be required, it is not possible to build them all into the food processor. Instead, the food processor will load its programs from a CD-ROM or similar medium.",Patterns Of Java,GOF
Structural,Virtual Proxy,"Suppose you are part of a team that has written a large Java applet for a company that operates a chain of home improvement warehouses. The applet allows people to buy everything that the warehouses sell through a Web page. In addition to offering a catalog, it includes a variety of assistants to allow customers to decide just what they need. There are more assistants, but they are not the point of this discussion. The point is that the applet is very large. Due to its size, it takes an unacceptably long amount of time for a browser to download the applet over a modem connection.",Patterns Of Java,GOF
Structural,Decorator,"Suppose you are responsible for maintaining the software of a security system that controls physical access to a building. Its basic architecture is that a card reader or other data entry device captures some identifying information and passes the information to the object that controls a door. If the object that controls the door is satisfied with the information, it unlocks the door. Suppose that you need to integrate this access control mechanism with a surveillance system. A surveillance system typically has more cameras connected to it than it has TV monitors. Most of the TV monitors cycle through the images from different cameras. They show a picture from each camera for a few seconds and then move on to the next camera for which the monitor is responsible. There are rules about how the surveillance system is supposed to be set up to ensure its effectiveness.",Patterns Of Java,GOF
Structural,Composite,"Suppose that you are writing a document formatting program. It formats characters into lines of text organized into columns that are organized into pages. However, a document may contain other elements. Columns and pages can contain frames that can contain columns. Columns, frames, and lines of text can contain images.",Patterns Of Java,GOF
Behavioral,Command,Suppose you want to design a word processing program so that it can undo and redo commands. A way to accomplish this is to materialize each command as an object with do and undo methods.,Patterns Of Java,GOF
Behavioral,Mediator,Suppose you have to implement a dialog box in order to specify information to reserve a banquet room in a hotel. The purpose of the dialog is to provide information to reserve a banquet room in a hotel. The requirements of the dialog give rise to a number of dependencies among the dialog's objects.,Patterns Of Java,GOF
