"Web Services Security	Web Services Policy Language	""Web services are services that are accessible by means of messages sent using standard web protocols", notations and naming conventions [Pap03]. In addition, they are self-describing through Web Services Description Language (WSDL) and can be discovered (perhaps automatically) using Universal Description, Discovery and Integration (UDDI). Therefore, using different syntaxes for their policy descriptions would reduce the two properties of self-description and discoverability. Moreover, security policies are typically issued by different actors in different departments, and the policies they write may concern a wide and overlapping set of web services. Applying the right policies to each access to a web service may also be complex, and thus error-prone. How can we describe policies to control web services invocations? The solution to this problem must resolve the following forces: The policies are issued by a variety of actors in an organization and may be stored in many locations. Web services consumers can also issue policies (requirements). For example," a consumer could require a service to have a certificate from a well-known certification authority. Any type of security policy should be enforceable. The policies are constantly changing and need to be constantly updated. We have a variety of subjects (roles). The environment in which an access is requested can also affect an access decision. Some policies can require a set of obligations to be performed in conjunction with policy enforcement (auditing).""	Security Patterns in Practice	SEC",,,,,,,,,,
"Web Services Security	WS-Policy	""In order to assure reliability", availability and security, web services need to apply policies. Without them," they will have no means of specifying what quality factors they enforce and require from their users. This situation would result in all kinds of problems for the institution and its users. The solution to this problem must resolve the following forces: Data security of web services. Malicious users may try to read or modify sensitive information stored in a web service. We need to define appropriate policies to protect this information. Guaranteed message exchange. We need to assure the delivery of messages between partners and give a requester the ability to verify whether the message was delivered. Policy integrity. Malicious users may try to replace or remove policy assertions for their own benefit. We need to ensure that policy assertions have not been modified. Mutual authentication. Clients and services must be able to mutually authenticate. Denial of service. An attacker could try to use malformed assertions to produce a non-terminating loop of policy evaluations.""	Security Patterns in Practice	SEC",,,,,,,,,,,,,,,
"Web Services Security	WS-Trust	""Establishing security relationships is fundamental for the interoperation of distributed systems. Without applying relevant trust relationships expressed in the same way between the involved parties", web services have no means of assuring security and interoperability in their integration. How can we define a means by which the parties are able to trust each other’s security credentials? The solution to this problem must resolve the following forces: Knowledge. In human relationships, we are concerned with first knowing a person before we trust them. That attitude applies also to web services. We need to have a structure that encapsulates some knowledge about the unit we intend to trust. Policy consideration. The web service policy contains all the required assertions and conditions that should be met to use that web service. The trust structure should consider this policy for verification purposes. Confidentiality and integrity. Policies may include sensitive information. Malicious consumers may acquire sensitive information, fingerprint the service and infer service vulnerabilities. This implies that the policy itself should be protected. Message integrity. The data to be transferred between the partners through messages may be private data that needs to be protected. Attackers may try to modify or replace these messages. Time validity. For protection purposes," any interactions or means of communications (including the trust relationships) between the web services should have a time limit that determines for how long the trust relationship is valid.""	Security Patterns in Practice	SEC",,,,,,,,,,,,,,
"Web Services Security	SAML Assertion	""A subject may need to access a resource in a domain that does not know about it because the relevant user is from a different security domain. In order to apply access control to the target domain’s resources", security information about the subject should be transmitted between those two domains. How can we communicate this information? The solution to this problem must resolve the following forces: The target security domain may implement different levels of security functionalities (authentication or not," access control or not). The identity management unit of the subject’s domain and the target security domain may be implemented using different platforms. We need a platform-independent way of communicating identity information. Different domains may express security constraints or apply authentication in different ways. We need a unifying structure.""	Security Patterns in Practice	SEC",,,,,,,,,,,,,,,,
"Web Services Cryptography	Symmetric Encryption	""Applications that communicate with external applications interchange sensitive data that may be read by unauthorized users while they are in transit. Clearly", if we send sensitive information, we are exposing confidential information and we may be risking the privacy of many individuals. How can we protect messages from being read by intruders? The solution to this problem must resolve the following forces: Confidentiality. Messages may be captured while they are in transit, so we need to prevent unauthorized users from reading them by hiding the information in the message. Convenient reception. The hidden information should be revealed conveniently to the receiver. Protocol. We need to apply the solution properly," or it will not be able to withstand attacks (there are several ways to attack a method of hiding information). Performance. The time to hide and recover the message should be acceptable. Security. In some cases we need to have a very high level of security.""	Security Patterns in Practice	SEC",,,,,,,,,,,,,,
"Web Services Cryptography	Asymmetric Encryption	""Applications that communicate with external applications interchange messages that may contain sensitive information. These messages can be intercepted and read by imposters during transmission. How can we send sensitive information securely over insecure channels? The solution to this problem must resolve the following forces: Confidentiality. Messages may be captured while they are in transit", so we need to prevent unauthorized users from reading them by hiding the information the message contains. Hiding information also makes replaying of messages by an attacker harder to perform. Reception. The hidden information should be revealed conveniently to the receiver. Protocol. We need to apply the solution properly, or it will not be able to withstand attacks (there are several ways to attack a method of hiding information). Performance. The time to hide and recover the message should be acceptable. Key distribution. Two parties may want to communicate to each other," but they have not agreed on a shared key: we need a way to send messages without establishing a common key.""	Security Patterns in Practice	SEC",,,,,,,,,,,,,,,
"Web Services Cryptography	Digital Signature with Hashing	""In many applications we need to verify the origin of a message (message authentication). Since an imposter may assume the identity of a principal", how can we verify that a message came from a particular principal? Also, messages that travel through insecure channels can be captured and modified by attackers. How can we know that the message or document that we are receiving has not been modified? The solution to this problem must resolve the following forces: For legal or business reasons we need to be able to verify who sent a particular message. Otherwise, we may not be sure of its origin, and the sender may deny having sent it (repudiation). Messages may be altered during transmission, so we need to verify that the data is in its original form when it reaches its destination. The length of the signed message should not be significantly larger than the original message," otherwise we would waste time and bandwidth. Producing a signed message should not require large computational power or take a long time.""	Security Patterns in Practice	SEC",,,,,,,,,,,,
"Web Services Cryptography	XML Encryption	""In many applications that communicate with external applications users exchange sensitive data. This data may be read by unauthorized people while the messages are in transit. How can we prevent this? The solution to this problem must resolve the following forces: Messages may be captured while they are in transit", so we need to prevent unauthorized users from reading them by hiding the information the message contains using encryption. We need to express encrypted elements in a standardized XML format to allow encrypted data to be nested within an XML message, otherwise different applications cannot interoperate. Different parts of a message may be intended for different recipients, and not all the information contained within a message should be available to all the recipients. Thus, recipients should be able to read only those parts of the message that are intended for them. For flexibility reasons, both symmetric and asymmetric encryption algorithms should be supported. If a secret key is embedded in the message, it should be protected," otherwise an attacker could read some messages.""	Security Patterns in Practice	SEC",,,,,,,,,,,
"Web Services Cryptography	XML Signature	""In many applications we need to verify the origin of a message (message authentication). Since an imposter may assume the identity of a principal", how can we verify that a message came from a particular principal? Also, messages that travel through insecure channels can be captured and modified by attackers. How do we know that the message or document that we are receiving has not been modified? The solution to this problem must resolve the following forces: For legal or business reasons we need to be able to verify who sent a particular message, otherwise we may not be sure of its origin, and the sender may deny having sent it (repudiation). We assume the sender has signed the message to prove they are its author. Messages may be altered during transmission, so we need to verify that the data is in its original form when it reaches its destination. The length of the signed message should not be significantly greater than the original message, otherwise we would waste time and bandwidth. Producing a signed message should not require a lot of computational power or take a long time. We need to express a digital signature in a standardized XML format, so interoperability can be ensured between applications. There may be situations in which we want to ensure proper origin or integrity in specific parts of a message. For example, an XML message can travel through many intermediaries that add or subtract information, so if we sign the entire message," the signature would have no meaning. We need to be able to sign portions of a message.""	Security Patterns in Practice	SEC",,,,,,,,
"Web Services Cryptography	WS-Security	""Sending messages through insecure channels exposes the messages to a variety of attacks", including illegal reading, modification or replay, and the sender can deny having sent a specific message [Sta06]. We have cryptographic solutions for these problems; however, there are many algorithms and protocols and we need to make a selection self-descriptive. The solution to this problem must resolve the following forces: Interoperability. We need a common format in SOAP messages in order to add security features, so both senders and receivers can process messages that contain security features without the need for previous agreements. Fine degree of protection. SOAP messages may travel through many intermediaries in a network environment," and different users may need access to different parts of them. We may need to protect different parts of a message in different ways.""	Security Patterns in Practice	SEC",,,,,,,,,,,,
"Secure Middleware	Secure Broker	""In addition to the liabilities of the broker [Bus96]", security threats add a new set of problems. How can we secure the broker’s activities? The threats affecting the pattern include: Illegal access. Clients’ access to servers may need to be restricted, and servers’ access to clients may need to be restricted, for compliance and application semantics purposes. Message interception or replaying. An attacker may intercept the messages from client to server and read or modify them. Message replaying is another possibility. Spoofing (forgery). If a rogue server can portray itself as valid to the broker, it can appear to service client requests while also compromising client data, or perform a wide variety of other attacks on unsuspecting clients. Likewise, if a rogue broker can portray itself as valid to servers and clients, it can do harm by recording traffic between clients and servers, substituting other clients and servers for valid ones, and so on. And if a client can forge its identity to a broker, it can access services for which it does not have rights. There are a wide variety of attacks based on forgery: redirection of traffic from official sites to forged sites; spamming while masking the source’s destination; cache poisoning, in which invalid entries are stored in the broker’s repository; and routing attacks, in which traffic intended for one destination is sent to another [NTC01]. Denial of service. Valid entries in the repository could be removed, and they will not be accessible. And with access to the broker’s server repository, DoS attacks can be launched against member servers. By limiting the server’s abilities to respond to requests," clients can be disabled [Kau02].""	Security Patterns in Practice	SEC",,,
"Secure Middleware	Secure Pipes and Filters	""The essence of the Pipes and Filters pattern is that every time data reaches a different stage", different functions are applied on it, and in a secure version these actions should be controlled. In this kind of system, we may also need the flexibility to reorder the steps of the process or change the processing steps. In the example above, a new person may be assigned to the workflow to perform additional functions on the documents, which may require adding an extra step. How can we control the actions to be performed in a data pipeline and provide security for the pipeline activities? Additionally, the data may be moved along the pipeline using insecure channels, and the users defining the data transformations may be remote. The solution to this problem must resolve the following forces: Stage control. The system may need to control, at each stage of processing, who can do what (what operations can be applied) with the data in the pipeline. This may be necessary in both automatic and interactive pipelines, otherwise employees might introduce illegal content or filter out wanted information. Authenticity. We might require the data or the message carrying it to be authenticated before it is accepted by the next or the previous stage, otherwise an imposter might send data to be processed. Message protection. Before sending data in the pipes we may need to hide it to prevent eavesdropping. We may also need to verify the authenticity of messages. Reconfiguration control. Due to regulatory constraints, work changes, or efficiency, some documents may need extra stages, or to skip stages. We need to be able to reconfigure the number or order of the steps. This reconfiguration should be controlled," or a user might skip necessary stages or add unintended stages. Recording. We should keep track of any actions applied to the data in cases where legal documents or regulatory compliance is involved. Transparency. The security controls should be transparent to the users of the pipeline. Overhead. The security controls should not affect performance significantly.""	Security Patterns in Practice	SEC",,
"Secure Middleware	Secure Blackboard	""Usually we want a variety of knowledge sources to solve a difficult problem or conduct a process. Nevertheless", how can we control the actions to be performed in the blackboard so that we provide the required level of security for the system? The solution to this problem must resolve the following forces: Nondeterminism. The sequence of activities or operations over data is usually unpredictable. Also, the number of knowledge sources might be hard to predict. Access control. Blackboard data should only be read or modified by authorized knowledge sources, otherwise users may see or override important information. Authenticity. It might be necessary to verify that the knowledge sources are authentic, otherwise we might receive false information, or our information could be leaked outside our system. The channels they use must be secure. Controlled reconfiguration. Due to regulatory constraints, work changes or efficiency, we need to be able to reconfigure the number of knowledge sources or their order of operation. This reconfiguration must be controlled. A faulty reconfiguration could lead to incorrect conclusions, or to the inclusion of inconsistent or erroneous information. Records. For billing and security purposes, logging the actions at each update of the blackboard may be necessary. This information can be audited later. Transparency. The security controls should be transparent to the users of the system," or they might not use them. Overhead. The security controls should not impose a significant overhead on the functions of the system.""	Security Patterns in Practice	SEC",,,,,,,,
"Secure Middleware	Secure Adapter	""The Adapter converts the interface of an existing class into a more convenient interface", but its original description does not take in consideration security issues. To illustrate and identify some possible attacks, consider the following example: we have an interface, RequestServices, which is used to request services from various servers. We want to be able to send requests to a JDBC API; however, our interface is incompatible with the JDBC API. We create a RequestServicesAdapter that adapts requests to JDBC. For example, a client sends a request for a database connection. The RequestServicesAdapter converts the request to a JDBC request, which in turn returns a response containing the requested data items. We can identify the following threats in this case: Threat 1 The database accessed through the JDBC interface could be an imposter, and we could be sending or receiving data from a malicious database. Threat 2 The client may be an imposter, trying to access the data of an authorized user. Threat 3 The client making the request may not have permission to send such a request; that is, the client may try to access data to which it is not authorized. Threat 4 If the client is remote," the data sent and received may be intercepted by intruders.""	Security Patterns in Practice	SEC",,,,,,,
"Secure Middleware	Secure Three-Tier Architecture	""Systems that contain sensitive and valuable data will attract attackers. How can we provide security in the presence of internal and external threats? The solution to this problem must resolve the following forces: Completeness. We need to secure all the tiers of the system. Leaving any layer unprotected will allow some attacks to succeed. Threats. Attacks may come from legitimate users", using the resources available to them, while other attacks may come from external users through Internet vulnerabilities. Possible misuses of the system include illegal reading or modification of information. These actions may have serious negative effects on the institution that owns the information, and so cannot be tolerated. We need to stop or mitigate these attacks. Availability and recovery. We need to provide availability through service continuity and robust recovery in case of disaster, otherwise economic losses might result. Transparency. The security system should be mostly transparent to the users. If the users need to perform special actions for security," they may just skip them. Accountability. A user may deny having carried out some action. We need to be able to show that they actually performed the action. Policies. We should be able to apply institution policies to control the use of the information.""	Security Patterns in Practice	SEC",,,,,,,,,,,,,
"Secure Middleware	Secure Enterprise Service Bus	""When an organization has many scattered services", how can we aggregate them so they can be used together to assemble applications, at the same time keeping the architectural structure as simple as possible, and apply uniform standards? The solution to this problem must resolve the following forces: Interoperability. It is fundamental for a business unit in an institution to be able to interact with a variety of services, internal or external. Simplicity of structure. We want a simple way to interconnect services; this simplifies the work of the integrators. Scalability. We need to have the ability to expand the number of interconnected services without making changes to the basic architecture. Message flexibility. We need to provide a variety of message invocation styles (synchronous and asynchronous) and formatting. We can thus accommodate all service needs. Simplicity of management. We need to monitor and manage many services, performing load balancing, logging, routing, format conversion and filtering. Flexibility. New types of services should be accommodated easily. Transparency. We should be able to find services without needing to know their locations. Quality of service. We may need to provide different degrees of security, reliability, availability or performance. Use of policies. We need a policy-based configuration and management. This allows convenient governance and systematic changes. Policies are high-level guidelines about architectural or institutional aspects, and are important in any system that supports systematic governance," as well as security and compliance [Sch06b]. Standard interfaces. We need explicit and formal interface contracts. Recording. We need to record sensitive transactions. Security. We can enumerate threats and add defenses.""	Security Patterns in Practice	SEC",,,,,,
"Secure Middleware	Secure Distributed Publish/Subscribe	Subscribers register and receive messages in which they are interested. How can we organize publishers and subscribers such that their interactions are secure? We relate threats to use cases as goals of the attacker [Fer06b]: Subscription S1: An imposter subscribes to receive information. S2: The publisher is an imposter and collects information (and maybe money) from potential subscribers. S3: The subscription messages are intercepted and read or modified by an attacker. Unsubscription U1: An imposter removes a subscriber. Publish P1: An imposter receives information illegally. P2: An imposter publishes illegal information. P3: An attacker reads or modifies intercepted information.	Security Patterns in Practice	SEC",,,,,,,,,,,,,,,,,,
"Secure Middleware	Secure Model-View-Controller	""How can we maintain an acceptable level of security between the model", the view and the controller in the presence of possible attacks? The solution to this problem must resolve the following forces: Authenticity. We need to be sure that users who interact with our system are legitimate. Remote users will want to be sure that our system is authentic. Confidentiality. We may need to restrict access to the model’s information to some users or roles. Also some portions of the data in transit from the model to the view must be protected against eavesdropping. Integrity. We may want to allow only some users or roles to make changes to the model," and only authorized changes. Records. The model may contain sensitive information and we want to have a record of all accesses to it.""	Security Patterns in Practice	SEC",,,,,,,,,,,,,,,,
