"Misuse	Worm	""A worm tries to take advantage of any input to invade a system. Users might open attachments carrying worms and some ports of a system may be unprotected or have vulnerabilities; all of these give the worm a chance to invade. Mail systems and file transfer systems for example", include lists of addresses that can be used by the worm to find places to which to propagate. Many systems do not control access to their system directories and do not restrict Internet traffic, which facilitates a worm invasion. The solution to this problem must resolve the following forces: Objectives. A worm’s objectives may be political, monetary or vandalism. A political or terrorist worm typically tries to produce damage to an antagonist; a monetary worm tries to reach many places to collect information or drop spyware; a vandal worm tries to destroy or damage information. Reach. To try to reach as many places as possible or to specific sites. For most worms, reaching many places is a basic objective. Presence manifestation. To try to show its presence in the system, so that victims know about it. Exceptions to this are cases in which the objective is to drop spyware. Credit. To embed an identification or mark so that the worm’s creator can take credit for it. Misuse. Perform some destruction and/or other misuses (confidentiality, integrity, or availability). The misuse may be delayed (time bomb). Obfuscation. To try to hide its structure to make its detection and removal harder. Collateral damage. In addition to specific misuses, the worm may require costly operations for its removal," stopping or disrupting business activities. Its propagation may affect the normal traffic in the network. Latency. A worm’s propagation must be as fast as possible to avoid detection and countermeasures. Activation. This can be done by enticing offers which may tempt users to open e-mail attachments or download procedures (social engineering). Other possibilities are invading through unprotected ports or taking advantage of vulnerabilities.""	Security Patterns in Practice	SEC",,,,,,,,,
"Misuse	Denial-of-Service in VoIP	""How can we trigger a DoS attack on a VoIP system? IP telephony subscribers need to be blocked from using VoIP services. The attack can be carried out by taking advantage of the following conditions: VoIP security is in an incipient phase at the moment: there is lack of expertise and security standards. Users might inadvertently expose the system. While some basic countermeasures exist", such as IDSs and firewalls, administrators may not configure them appropriately due to a lack of training and time. Until now VoIP has been developed and deployed focusing on functionality with less thought for security [Wie06b]. That means that the defenses that are in place are not very advanced. For example, strong authentication is not common in VoIP. With the rush to implement new VoIP systems, features and standards, implementation flaws are common. IP PBXs include many layers of software that may contain vulnerabilities. Programming mistakes, such as not properly checking the size of the parameters of a protocol request, when exploited, can result in the following issues: Remote access. An attacker obtaining remote (often administrator level) access. Malformed request DoS. A carefully crafted protocol request (a packet) exploiting a vulnerability that results in a partial or complete loss of function (in this case a single malformed packet may lead to a DoS). Load-based DoS. A flood of legitimate requests overwhelming a system [Col04]. As with any network-based service, enterprise VoIP must communicate with other components on a LAN and possibly over an untrusted network such as the Internet, where packets are easy to intercept. Because RTP (real-time transport protocol) carries media that must be delivered in real time to be usable for an acceptable conversation, VoIP is vulnerable to DoS attacks that impact the quality delivery of audio, such as those that affect jitter and delay. VoIP traffic can offer very good cover for DoS attacks," because VoIP runs continuous media over IP packets [CRN06].""	Security Patterns in Practice	SEC",,,,,
"Misuse	Spoofing Web Services	""How we can effectively perform a principal spoofing attack against web services so that we can access the information of another user? The attack can take advantage of the following vulnerabilities: Currently there is no method of verifying identity unequivocally. When a WSDL file is published", the interfaces of the web service are exposed, and thus its entry points. The source address of the request can be altered. There is a tendency to trust presented credentials without a more thorough check. Once the authentication stage is passed, other attacks can be generated more easily: for example, DDoS attacks Maybe the interchanged data items are not encrypted," and it may be possible to steal the credentials using special software. The resulting damage depends on the privileges of the credentials submitted.""	Security Patterns in Practice	SEC",,,,,,,,,,,,,
"Cloud Computing Architecture	Infrastructure-as-a-Service	""Some organizations do not have the resources to invest in the infrastructure", middleware or applications that are needed to run their businesses. Also, they may not be able to handle increases in demand, or cannot afford to maintain and store unused resources. How can we provide these users with quality access to computational resources? The solution to this problem must resolve the following forces: Transparency. The underlying architecture should be transparent to its users. Users should be able to use the provider’s services without understanding its infrastructure. Flexibility. Different infrastructure configurations and resource volumes can be demanded by users. Elasticity. Users should be able to expand or reduce resources in order to meet the different needs of their applications. Pay-per-use. Users should only pay for the resources they consume. On-demand-service. Services should be provided on demand. Manageability. In order to manage a large volume of service requests," cloud resources must be easy to deploy and manage. Accessibility. Users should be able to access resources from anywhere at any time. Testability. We intend to develop system programs in this environment and we need to test them conveniently. Shared resources. Many users should be able to share resources in order to increase the volume of resource utilization and thus reduce costs. Isolation. Different user execution instances should be isolated from each other. Shared non-functional requirements provision (NFRs). Sharing of the costs of providing NFRs is necessary to allow providers to offer a higher level of NFRs. Security. The IaaS level is the basis for execution of the complete cloud system and its degree of security will affect all the applications running on it. We should provide a convenient and measurable structure to define security requirements.""	Security Patterns in Practice	SEC",,,,,,,,,,,,,,
"Cloud Computing Architecture	Platform-as-a-Service	""Organizations may want to develop their own custom applications without buying and maintaining the developing tools", databases, operating systems and infrastructure underlying them. Also, when a team is spread across several locations, it is necessary to have a convenient way to coordinate their work. How can we provide secure PaaS functions? The solution to this problem must resolve the following forces: Collaboration. Sometimes teams of developers are located in different geographic locations. When working on a project, they all should have access to the development tools, code and data. Coordination. When many developers work on a complex project, they need to coordinate their work. Elasticity. There should be a way to increase or decrease resources for more compute-intense development and deployment tasks. Pay-per-use. Parties should only pay for the resources that they use. Transparency. Developers should not have to be concerned about the underlying infrastructure, including hardware and operating systems, and its configuration for development and deployment. On-demand services. Developers should be able to request an application tool and start using it. Accessibility. Developers should be able to access tools via standard networks, from anywhere at any time. Testability. We intend to develop application programs in this environment and we need to test them conveniently. Versatility. The platform should be able to be used to build applications for any domain or type of application. Different options for developing tools should be offered to the users. Simplification. Developers should be able to build applications without installing any tool or specialized software on their computers. Security. The platform should offer facilities for developing secure programs," and should itself be protected from attacks.""	Security Patterns in Practice	SEC",,,,,,,
"Cloud Computing Architecture	Software-as-a-Service	""Customers may need to use software products that do not require local installation and maintenance of the software. How can software be delivered over the network? The solution to this problem must resolve the following forces: Pay-per-use. Customers should be charged on a per-use basis", like utility services. Transparency. Customers should not be concerned about maintenance or updates to the software. On-demand services. Customers should have the ability to start using an application when they need to. Accessibility. Customers should be able to access the software applications at any time and anywhere. Flexibility. Customers should be able to configure the software application to their needs, such as currency or date formats. Elasticity. Applications should be able to scale down or up depending on the customers’ needs [Ju10]. For example," it should be possible to increase or decrease the number of users using the application. Simplification. Customers should not need to install any special software on their local machine. Security. The software offered to users must be secure: it should be built following a secure methodology [Uzu12c].""	Security Patterns in Practice	SEC",,,,,,,,,,,,,,,
