Creational,Prototype,specifi kind object creat use prototyp instanc creat new object copi prototypecoopt one instanc class use breeder futur instancesth new oper consid harmfulappl hard wire class object creat new expressiondeclar abstract base class specifi pure virtual clone method maintain dictionari cloneabl concret deriv class class need polymorph constructor capabl deriv abstract base class regist prototyp instanc implement clone operationth client instead write code invok new oper hardwir class name call clone oper abstract base class suppli string enumer data type design particular concret deriv class desir
Creational,Builder,separ construct complex object represent construct process creat differ representationspars complex represent creat one sever targetsan applic need creat element complex aggreg specif aggreg exist secondari storag one mani represent need built primari storagesepar algorithm interpret ie read pars store persist mechan eg rtf file algorithm build repres one mani target product eg ascii tex text widget focusdistinct creat complex aggregatesth director invok builder servic interpret extern format builder creat part complex object time call maintain intermedi state product finish client retriev result builderafford finer control construct process unlik creation pattern construct product one shot builder pattern construct product step step control director
Structural,Proxy,provid surrog placehold anoth object control access itus extra level indirect support distribut control intellig accessadd wrapper deleg protect real compon undu complexityy need support resourcehungri object want instanti object unless actual request clientdesign surrog proxi object instanti real object first time client make request proxi rememb ident real object forward instig request real object subsequ request simpli forward directli encapsul real objectther four common situat proxi pattern applicablecount number refer real object freed automat refer aka smart pointerload persist object memori first referencedcheck real object lock access ensur object chang
Creational,Factory Method,defin interfac creat object let subclass decid class instanti factori method let class defer instanti subclassesdefin virtual constructorth new oper consid harmfula framework need standard architectur model rang applic allow individu applic defin domain object provid instantiationfactori method creat object templat method implement algorithm superclass specifi standard gener behavior use pure virtual placehold creation step deleg creation detail subclass suppli clientfactori method make design customiz littl complic design pattern requir new class wherea factori method requir new operationpeopl often use factori method standard way creat object isnt necessari class that instanti never chang instanti take place oper subclass easili overrid initi operationfactori method similar abstract factori without emphasi familiesfactori method routin specifi architectur framework implement user framework
Creational,Abstract Factory,provid interfac creat famili relat depend object without specifi concret classesa hierarchi encapsul mani possibl platform construct suit productsth new oper consid harmfulif applic portabl need encapsul platform depend platform might includ window system oper system databas etc often encapsul engin advanc lot ifdef case statement option current support platform begin procreat like rabbit throughout codeprovid level indirect abstract creation famili relat depend object without directli specifi concret class factori object respons provid creation servic entir platform famili client never creat platform object directli ask factori themthi mechan make exchang product famili easi specif class factori object appear applic instanti applic wholesal replac entir famili product simpli instanti differ concret instanc abstract factorybecaus servic provid factori object pervas routin implement singleton
Structural,Facade,provid unifi interfac set interfac subsystem facad defin higherlevel interfac make subsystem easier usewrap complic subsystem simpler interfacea segment client commun need simplifi interfac overal function complex subsystemfacad discuss encapsul complex subsystem within singl interfac object reduc learn curv necessari success leverag subsystem also promot decoupl subsystem potenti mani client hand facad access point subsystem limit featur flexibl power user may needth facad object fairli simpl advoc facilit becom allknow oracl god object
Structural,Composite,compos object tree structur repres wholepart hierarchi composit let client treat individu object composit object uniformlyrecurs compositiondirectori contain entri could directory1tomani hierarchyappl need manipul hierarch collect primit composit object process primit object handl one way process composit object handl differ queri type object attempt process desirabledefin abstract base class compon specifi behavior need exercis uniformli across primit composit object subclass primit composit class compon class composit object coupl abstract type compon manag childrenus pattern whenev composit contain compon could compositechild manag method eg addchild removechild normal defin composit class unfortun desir treat primit composit uniformli requir method move abstract compon class see opinion section discuss safeti versu transpar issu
Structural,Decorator,attach addit respons object dynam decor provid flexibl altern subclass extend functionalityclientspecifi embellish core object recurs wrap itwrap gift put box wrap boxyou want add behavior state individu object runtim inherit feasibl static appli entir classsuppos work user interfac toolkit wish support ad border scroll bar window could defin inherit hierarchi like decor pattern suggest give client abil specifi whatev combin featur desiredthi flexibl achiev follow design anoth exampl cascad chain featur togeth produc custom object might look like solut class problem involv encapsul origin object insid abstract wrapper interfac decor object core object inherit abstract interfac interfac use recurs composit allow unlimit number decor layer ad core objectnot pattern allow respons ad object method object interfac interfac present client must remain constant success layer specifiedalso note core object ident hidden insid decor object tri access core object directli problem
Structural,Adapter,convert interfac class anoth interfac client expect adapt let class work togeth couldnt otherwis incompat interfaceswrap exist class new interfaceimped match old compon new systeman shelf compon offer compel function would like reus view world compat philosophi architectur system current developedreus alway pain elus one reason tribul design someth new reus someth old alway someth quit right old new may physic dimens misalign may time synchron may unfortun assumpt compet standardsit like problem insert new threeprong electr plug old twoprong wall outlet – kind adapt intermediari necessari adapt creat intermediari abstract translat map old compon new system client call method adapt object redirect call legaci compon strategi implement either inherit aggregationadapt function wrapper modifi exist class provid differ translat view class
Structural,Bridge,decoupl abstract implement two vari independentlypublish interfac inherit hierarchi buri implement inherit hierarchybeyond encapsul insulationharden softwar arteri occur use subclass abstract base class provid altern implement lock compiletim bind interfac implement abstract implement cannot independ extend composedconsid domain thread schedul two type thread schedul two type oper system platform given approach special defin class permut two dimens add new platform say java virtual machin would hierarchi look like three kind thread schedul four kind platform five kind thread schedul ten kind platform number class would defin product number schedul scheme number platformsth bridg design pattern propos refactor exponenti explos inherit hierarchi two orthogon hierarchi – one platformindepend abstract platformdepend implement decompos compon interfac implement orthogon class hierarchi interfac class contain pointer abstract implement class pointer initi instanc concret implement class subsequ interact interfac class implement class limit abstract maintain implement base class client interact interfac class turn deleg request implement classth interfac object handl known use client implement object bodi safe encapsul ensur may continu evolv entir replac share runtimeus bridg pattern whenyou want runtim bind implementationy prolifer class result coupl interfac numer implementationsy want share implement among multipl objectsy need map orthogon class hierarchiesconsequ includedecoupl object interfaceimprov extens extend ie subclass abstract implement hierarchi independentlyhid detail clientsbridg synonym handlebodi idiom design mechan encapsul implement class insid interfac class former bodi latter handl handl view user actual class work done bodi handlebodi class idiom may use decompos complex abstract smaller manag class idiom may reflect share singl resourc multipl class control access eg refer count
